{
  "capabilities": {
    "extraction": "gazetteer",
    "morphology": "paradigm-table",
    "normalization": "rules",
    "search": "analyzer",
    "segmentation": "profile",
    "terminology": "kb"
  },
  "capabilityEvidence": [
    {
      "evaluationRecordIds": [
        "eval:fr-core:basic-segmentation-baseline:distribution:textpack-fr",
        "eval:fr-core:iana-language-profile:distribution:textpack-fr",
        "eval:fr-core:latin-orthography-ranges:distribution:textpack-fr",
        "eval:fr-core:unicode-punctuation-ranges:distribution:textpack-fr"
      ],
      "evidenceLevel": "resource-evaluated",
      "limitations": [
        "Evaluated in internal build unit @ismail-elkorchi/textpack-fr-core; the referenced payload is shipped directly in @ismail-elkorchi/textpack-fr.",
        "This verifies a basic Unicode UAX #29 segmentation baseline; richer French segmentation is provided by textpack-fr-segmentation."
      ],
      "resourceIds": [
        "fr-core-language-profile",
        "fr-core-orthography",
        "fr-core-punctuation",
        "fr-core-basic-segmentation"
      ],
      "slot": "core",
      "status": "profiled",
      "tier": "resource-only"
    },
    {
      "evaluationRecordIds": [],
      "evidenceLevel": "none",
      "limitations": [],
      "resourceIds": [],
      "slot": "corpus",
      "status": "planned",
      "tier": "none"
    },
    {
      "evaluationRecordIds": [],
      "evidenceLevel": "none",
      "limitations": [],
      "resourceIds": [],
      "slot": "foundation",
      "status": "profiled",
      "tier": "resource-only"
    },
    {
      "evaluationRecordIds": [
        "eval:wikidata-fr:alias-coverage:distribution:textpack-fr",
        "eval:wikidata-fr:entity-extract:distribution:textpack-fr",
        "eval:wikidata-fr:relation-coverage:distribution:textpack-fr"
      ],
      "evidenceLevel": "resource-evaluated",
      "limitations": [
        "Evaluated in internal build unit @ismail-elkorchi/textpack-wikidata-fr; the referenced payload is shipped directly in @ismail-elkorchi/textpack-fr.",
        "The Wikidata French extract is scoped to declared core entity classes and thresholds; it is not a full Wikidata dump."
      ],
      "resourceIds": [
        "wikidata-fr-entities",
        "wikidata-fr-aliases",
        "wikidata-fr-relations",
        "wikidata-fr-kb-canonical",
        "wikidata-fr-entities-lookup-index",
        "wikidata-fr-aliases-lookup-index",
        "wikidata-fr-relations-lookup-index"
      ],
      "slot": "kb",
      "status": "task-supported",
      "tier": "lookup"
    },
    {
      "evaluationRecordIds": [
        "eval:language-registry:bcp47-record-volume:distribution:textpack-fr",
        "eval:language-registry:bcp47-type-coverage:distribution:textpack-fr"
      ],
      "evidenceLevel": "resource-evaluated",
      "limitations": [
        "Evaluated in internal build unit @ismail-elkorchi/textpack-language-registry; the referenced payload is shipped directly in @ismail-elkorchi/textpack-fr."
      ],
      "resourceIds": [
        "bcp47-language-subtags",
        "bcp47-language-registry-summary"
      ],
      "slot": "language-registry",
      "status": "profiled",
      "tier": "resource-only"
    },
    {
      "evaluationRecordIds": [
        "eval:fr-lexique:entry-volume:distribution:textpack-fr",
        "eval:fr-lexique:lemma-volume:distribution:textpack-fr"
      ],
      "evidenceLevel": "resource-evaluated",
      "limitations": [
        "Evaluated in internal build unit @ismail-elkorchi/textpack-fr-lexique-sa; the referenced payload is shipped directly in @ismail-elkorchi/textpack-fr.",
        "Lexique 3.83 is an isolated share-alike lexical database and does not unlock the default French composite."
      ],
      "resourceIds": [
        "fr-lexique-entries",
        "fr-lexique-lemmas",
        "fr-lexique-lexicon-canonical",
        "fr-lexique-entries-lookup-index"
      ],
      "slot": "lexicon",
      "status": "task-supported",
      "tier": "lookup"
    },
    {
      "evaluationRecordIds": [
        "eval:cldr-core:likely-subtag-coverage:distribution:textpack-fr",
        "eval:cldr-core:locale-alias-coverage:distribution:textpack-fr",
        "eval:cldr-core:script-variant-coverage:distribution:textpack-fr"
      ],
      "evidenceLevel": "resource-evaluated",
      "limitations": [
        "Evaluated in internal build unit @ismail-elkorchi/textpack-cldr-core; the referenced payload is shipped directly in @ismail-elkorchi/textpack-fr."
      ],
      "resourceIds": [
        "cldr-48-likely-subtags",
        "cldr-48-locale-aliases",
        "cldr-48-script-data",
        "cldr-48-core-summary"
      ],
      "slot": "locale-profile",
      "status": "profiled",
      "tier": "resource-only"
    },
    {
      "evaluationRecordIds": [
        "eval:fr-lexique:pos-inventory:distribution:textpack-fr",
        "eval:fr-unimorph:entry-volume:distribution:textpack-fr",
        "eval:fr-unimorph:feature-inventory:distribution:textpack-fr",
        "eval:fr-unimorph:indexed-analysis-volume:distribution:textpack-fr",
        "eval:fr-unimorph:indexed-generation-volume:distribution:textpack-fr"
      ],
      "evidenceLevel": "resource-evaluated",
      "limitations": [
        "Evaluated in internal build unit @ismail-elkorchi/textpack-fr-lexique-sa; the referenced payload is shipped directly in @ismail-elkorchi/textpack-fr.",
        "Evaluated in internal build unit @ismail-elkorchi/textpack-fr-unimorph-sa; the referenced payload is shipped directly in @ismail-elkorchi/textpack-fr.",
        "UniMorph French is an isolated share-alike paradigm source and does not unlock the default French composite."
      ],
      "resourceIds": [
        "fr-lexique-entries",
        "fr-lexique-pos-inventory",
        "fr-lexique-morphology-canonical",
        "fr-lexique-entries-lookup-index",
        "fr-unimorph-paradigms",
        "fr-unimorph-feature-inventory",
        "fr-unimorph-pos-inventory",
        "fr-unimorph-morphology-canonical",
        "fr-unimorph-paradigms-lookup-index"
      ],
      "slot": "morphology",
      "status": "task-supported",
      "tier": "lookup"
    },
    {
      "evaluationRecordIds": [
        "eval:fr-normalization:cldr-likely-subtag:distribution:textpack-fr",
        "eval:fr-normalization:gold-cases:distribution:textpack-fr",
        "eval:fr-normalization:observed-contraction-forms:distribution:textpack-fr",
        "eval:fr-normalization:observed-elision-prefixes:distribution:textpack-fr",
        "eval:fr-normalization:profile-rules:distribution:textpack-fr",
        "eval:fr-normalization:unicode-nfc-evidence:distribution:textpack-fr"
      ],
      "evidenceLevel": "resource-evaluated",
      "limitations": [
        "Evaluated in internal build unit @ismail-elkorchi/textpack-fr-normalization; the referenced payload is shipped directly in @ismail-elkorchi/textpack-fr.",
        "This records French contraction surface forms observed in the pinned Tatoeba corpus; syntactic expansion lives in syntax/treebank resources.",
        "This verifies observed modern French apostrophe/elision surface policy from Tatoeba; it is not historical or OCR normalization.",
        "This verifies the generated Unicode/CLDR normalization profile, not spelling correction or noisy-text normalization accuracy."
      ],
      "resourceIds": [
        "fr-normalization-rules",
        "fr-normalization-profile",
        "fr-normalization-elision-prefixes",
        "fr-normalization-contraction-forms",
        "fr-normalization-gold-cases"
      ],
      "slot": "normalization",
      "status": "task-supported",
      "tier": "rule-based"
    },
    {
      "evaluationRecordIds": [],
      "evidenceLevel": "none",
      "limitations": [],
      "resourceIds": [],
      "slot": "parallel",
      "status": "planned",
      "tier": "none"
    },
    {
      "evaluationRecordIds": [
        "eval:fr-core:transform-rejections:distribution:textpack-fr",
        "eval:fr-lexique:transform-rejections:distribution:textpack-fr",
        "eval:fr-normalization:transform-rejections:distribution:textpack-fr",
        "eval:fr-segmentation:gold-cases:distribution:textpack-fr",
        "eval:fr-segmentation:observed-abbreviation-policy:distribution:textpack-fr",
        "eval:fr-segmentation:observed-contraction-token-policy:distribution:textpack-fr",
        "eval:fr-segmentation:transform-rejections:distribution:textpack-fr",
        "eval:fr-unimorph:transform-rejections:distribution:textpack-fr"
      ],
      "evidenceLevel": "resource-evaluated",
      "limitations": [
        "Abbreviation rows are reference candidates observed in Tatoeba. The built-in adapter executes the explicit sentence-boundary exceptions in the generated profile; it does not infer exceptions from this table.",
        "Evaluated in internal build unit @ismail-elkorchi/textpack-fr-core; the referenced payload is shipped directly in @ismail-elkorchi/textpack-fr.",
        "Evaluated in internal build unit @ismail-elkorchi/textpack-fr-lexique-sa; the referenced payload is shipped directly in @ismail-elkorchi/textpack-fr.",
        "Evaluated in internal build unit @ismail-elkorchi/textpack-fr-normalization; the referenced payload is shipped directly in @ismail-elkorchi/textpack-fr.",
        "Evaluated in internal build unit @ismail-elkorchi/textpack-fr-segmentation; the referenced payload is shipped directly in @ismail-elkorchi/textpack-fr.",
        "Evaluated in internal build unit @ismail-elkorchi/textpack-fr-unimorph-sa; the referenced payload is shipped directly in @ismail-elkorchi/textpack-fr.",
        "These generated cases document source-derived expectations; the built-in adapter executes pinned Unicode segmentation, explicit sentence-boundary exceptions, and French elision-prefix splitting.",